{
  "$schema": "https://json-schema.org/draft/2020-12/schema",
  "$id": "https://github.com/chuanseng-ng/hdl-schemview/elaborate/svxprobe_elaborate/schema/model.schema.json",
  "title": "hdl-schemview elaborated Node model",
  "description": "Serialized projection of the slang-elaborated hierarchy. This is the integration contract between the pyslang harness (producer) and the Rust core (consumer). Phase 0 emits the structural spine; drivers/loads stay empty until Phase 1.",
  "type": "object",
  "required": ["schema_version", "design", "files", "nodes"],
  "additionalProperties": false,
  "properties": {
    "schema_version": { "type": "integer", "const": 1 },
    "design": { "type": "string", "description": "Top module name." },
    "generator": {
      "type": "object",
      "description": "Provenance of this serialization.",
      "properties": {
        "tool": { "type": "string" },
        "version": { "type": "string" }
      },
      "additionalProperties": true
    },
    "files": {
      "type": "array",
      "description": "File table; ranges reference entries by index via the `file` field.",
      "items": {
        "type": "object",
        "required": ["id", "path"],
        "additionalProperties": false,
        "properties": {
          "id": { "type": "integer", "minimum": 0 },
          "path": { "type": "string" },
          "language": {
            "type": ["string", "null"],
            "description": "Source language of this file (#159): \"systemverilog\" for elaborated RTL, or \"c\"/\"cpp\" for a high-level source referenced only by HLS provenance comments. Absent/null defaults to systemverilog. Lets the frontend pick a pane and the resolver route a cross-language probe."
          }
        }
      }
    },
    "nodes": {
      "type": "array",
      "items": { "$ref": "#/$defs/node" }
    },
    "edges": {
      "type": "array",
      "description": "Port-connection edges: a module port wired to an external endpoint (net/var/port/interface). Direction is the port's.",
      "items": {
        "type": "object",
        "required": ["id", "port", "endpoint", "dir"],
        "additionalProperties": false,
        "properties": {
          "id": { "type": "integer", "minimum": 0 },
          "port": { "type": "integer", "minimum": 0, "description": "NodeId of the module port." },
          "endpoint": { "type": "integer", "minimum": 0, "description": "NodeId of the connected endpoint." },
          "dir": { "type": "string", "enum": ["in", "out", "inout"] },
          "select": { "type": ["string", "null"], "description": "Resolved bit-select on the connected expression, e.g. \"[0]\" or \"[7:4]\"; absent/null when the whole signal is connected." },
          "mem_port": { "type": ["string", "null"], "enum": ["addr", "din", "dout", null], "description": "Memory-access role (#112): set when the edge wires a signal to a Memory node's address/data port (addr/din/dout), so the schematic draws the pin's role. Absent/null on ordinary edges." },
          "mux_port": { "type": ["string", "null"], "enum": ["sel", "d0", "d1", null], "description": "Mux-port role (#157, ADR 0005): set when the edge feeds a gate-level Mux node's select/data input (sel/d0/d1), so the schematic places it correctly. Absent/null on ordinary edges." }
        }
      }
    },
    "enums": {
      "type": "object",
      "description": "Normalized enum table keyed by canonical type string (matching a node's `type`): the value->name members for FSM/enum state display. Enums with non-literal members are omitted.",
      "additionalProperties": { "$ref": "#/$defs/enumDef" }
    },
    "source_map": {
      "type": "array",
      "description": "HLS C/C++ <-> RTL provenance map (#159): a bidirectional, line-region correspondence linking a span of generated RTL to the high-level C/C++ span it came from. Populated by the harness's --hls-map pass from the line-annotated provenance comments HLS tools write into the generated RTL. The single source of truth for C<->RTL source cross-probing (a lookup, not a heuristic). Absent/empty when no provenance comments are found.",
      "items": {
        "type": "object",
        "required": ["generated", "source"],
        "additionalProperties": false,
        "properties": {
          "generated": { "$ref": "#/$defs/range", "description": "Span in a generated (systemverilog) file." },
          "source": { "$ref": "#/$defs/range", "description": "Span in the high-level (c/cpp) source file." }
        }
      }
    },
    "name_refs": {
      "type": "array",
      "description": "Identifier-occurrence spans (#225): every declaration name token and every resolved value reference, each classified by the symbol the elaboration resolved it to. Populated by the harness's --name-refs pass; absent when it did not run. Backs semantic name coloring in the source pane and lets a click on a *usage* resolve to the signal it names (the model otherwise carries declaration spans only). Sorted by (file, offset), one record per span.",
      "items": { "$ref": "#/$defs/nameRef" }
    }
  },
  "$defs": {
    "nameRef": {
      "type": "object",
      "required": ["file", "line", "col", "offset", "len", "class", "rel"],
      "additionalProperties": false,
      "properties": {
        "file": { "type": "integer", "minimum": 0, "description": "Index into the files table." },
        "line": { "type": "integer", "minimum": 1, "description": "1-based line of the identifier. Line/col are line-ending independent, so the frontend renders against these." },
        "col": { "type": "integer", "minimum": 1, "description": "1-based byte column of the identifier's first character." },
        "offset": { "type": "integer", "minimum": 0, "description": "Byte offset of the identifier, on the same basis as a node's `def_range` — the resolver's lookup key." },
        "len": { "type": "integer", "minimum": 1, "description": "Byte length of the occurrence. A qualified reference spans the whole reference (`bus.valid`, `soc_pkg::XLEN`), not just its last segment." },
        "class": {
          "type": "string",
          "enum": ["module", "instance", "port", "signal", "param", "type", "enum-member", "function", "interface", "modport", "genvar"],
          "description": "What the elaboration resolved this identifier to. Read off the symbol, never inferred from the token text: an identifier that cannot be classified yields no record at all."
        },
        "rel": {
          "type": "string",
          "description": "Symbol path relative to the enclosing elaborated scope (`clk`, `g_lane[0].bus.valid`), so one span serves every instantiation of its module. Empty means the token names the scope itself (a module definition's name). A symbol outside that scope (package parameter, cross-hierarchy reference) is stored absolute with a leading `/` — a character SV paths never contain."
        }
      }
    },
    "enumDef": {
      "type": "object",
      "required": ["width", "members"],
      "additionalProperties": false,
      "properties": {
        "width": { "type": "integer", "minimum": 0, "description": "Bit width of the enum base type." },
        "members": {
          "type": "array",
          "items": {
            "type": "object",
            "required": ["name", "value"],
            "additionalProperties": false,
            "properties": {
              "name": { "type": "string" },
              "value": { "type": "integer", "minimum": 0 }
            }
          }
        }
      }
    },
    "modportMember": {
      "type": "object",
      "required": ["name", "dir"],
      "additionalProperties": false,
      "properties": {
        "name": { "type": "string", "description": "Member signal name within the interface." },
        "dir": { "type": "string", "enum": ["in", "out", "inout"], "description": "Direction of the member through this modport view." }
      }
    },
    "location": {
      "type": "object",
      "required": ["line", "col", "offset"],
      "additionalProperties": false,
      "properties": {
        "line": { "type": "integer", "minimum": 0 },
        "col": { "type": "integer", "minimum": 0 },
        "offset": { "type": "integer", "minimum": 0 }
      }
    },
    "range": {
      "type": "object",
      "required": ["file", "start", "end"],
      "additionalProperties": false,
      "properties": {
        "file": { "type": "integer", "minimum": 0, "description": "Index into the files table." },
        "start": { "$ref": "#/$defs/location" },
        "end": { "$ref": "#/$defs/location" }
      }
    },
    "node": {
      "type": "object",
      "required": ["id", "kind", "name", "path", "parent", "children", "symbol_key"],
      "additionalProperties": false,
      "properties": {
        "id": { "type": "integer", "minimum": 0 },
        "kind": {
          "type": "string",
          "enum": ["Instance", "Net", "Port", "Var", "Param", "ModuleDef", "GenBlock", "FF", "Comb", "Latch", "Assign", "Interface", "Modport", "Memory", "And", "Or", "Xor", "Xnor", "Nand", "Nor", "Not", "Buf", "Add", "Sub", "Mul", "Cmp", "Shift", "Mux", "Const", "Concat"]
        },
        "name": { "type": "string" },
        "path": { "type": "string", "description": "Canonical elaborated hierarchical path." },
        "parent": { "type": ["integer", "null"] },
        "children": { "type": "array", "items": { "type": "integer", "minimum": 0 } },
        "symbol_key": { "type": "string", "description": "Stable per-symbol key; absorbs generate/param expansion." },
        "def_range": { "anyOf": [ { "$ref": "#/$defs/range" }, { "type": "null" } ] },
        "inst_range": { "anyOf": [ { "$ref": "#/$defs/range" }, { "type": "null" } ] },
        "type": { "type": ["string", "null"], "description": "Type string for signal nodes." },
        "dir": {
          "type": ["string", "null"],
          "enum": ["in", "out", "inout", null],
          "description": "Declared direction for Port nodes (drives schematic pin side); null otherwise."
        },
        "const": {
          "type": ["string", "null"],
          "description": "A literal or resolved parameter value the model states, e.g. \"32'd0\": on a Port input tied to a literal, on a gate operand via a Const/Param node, or on an Assign/Comb block whose whole expression is a literal (the net it drives is tied to that value). Null when the value is computed or net-driven."
        },
        "modport": {
          "type": ["string", "null"],
          "description": "View name on a modport-specialized interface port (e.g. \"mem\" for `mem_if.mem bus`); null otherwise."
        },
        "reset": {
          "type": ["string", "null"],
          "description": "FF only: canonical path of the async-reset signal — the timing-control edge whose signal the process body also reads (#59). Absent/null when the FF has no async reset or the rule cannot disambiguate."
        },
        "enable": {
          "type": ["string", "null"],
          "description": "Latch only: canonical path of the gating (enable) signal — the sole signal read by the body's top-level conditional (#59). Absent/null when no single gating signal exists."
        },
        "members": {
          "type": ["array", "null"],
          "description": "Membership of a Modport node: each bundle member visible through the view, with its direction (slang ModportPort.direction). Descriptive metadata -- the modport stays a view; the member's own node lives in the parent interface instance at `<parent path>.<name>`. Absent/null on non-modport nodes.",
          "items": { "$ref": "#/$defs/modportMember" }
        },
        "mem_depth": {
          "type": ["integer", "null"],
          "minimum": 0,
          "description": "Memory only: word count of the array (unpacked dimension size, e.g. 512 for `ram [0:511]`), a structural fact from slang used to label the MEMORY glyph. Absent/null on non-memory nodes (#112)."
        },
        "init_source": {
          "type": ["string", "null"],
          "description": "Memory only: the $readmemh/$readmemb initializer's source-file argument text (e.g. \"INIT_FILE\"); presence drives the INIT marker. From the harness's initial-block scan -- initial stays non-logic (ADR 0004). Absent/null when the memory has no $readmem* initializer (#112)."
        },
        "op": {
          "type": ["string", "null"],
          "description": "Gate-level datapath primitives only (#157, ADR 0005): the exact operator behind a coarse Add/Sub/Mul/Cmp/Shift kind (e.g. \"LessThan\", \"LogicalShiftLeft\"), for the box label. Absent/null on non-gate nodes and on bitwise/reduction gates whose kind already names them."
        },
        "drivers": { "type": "array", "items": { "type": "integer" }, "default": [] },
        "loads": { "type": "array", "items": { "type": "integer" }, "default": [] }
      }
    }
  }
}
